IndicatorCode,IndicatorName
NCD_BMI_30A,"Prevalence of obesity among adults, BMI &GreaterEqual; 30 (age-standardized estimate) (%)"
NCD_GLUC_03,Raised fasting blood glucose (>= 7.0 mmol/L) (crude estimate)
NCD_DIABETES_PREVALENCE_CRUDE,"Prevalence of diabetes, crude"
NCD_PAA,Prevalence of insufficient physical activity among adults aged 18+ years (age-standardized estimate) (%)
WSH_SANITATION_BASIC,Population using at least basic sanitation services (%)
PHE_HHAIR_PROP_POP_POLLUTING_FUELS,Proportion of population with primary reliance on polluting fuels and technologies for cooking (%)
WHOSIS_000001,Life expectancy at birth (years)
WHS5_512,Population using solid fuels (%)
SI_POV_DAY1,Proportion of population below the international poverty line of US$1.90 per day (%)
